[
  {
    "Mhv1_id": 184201,
    "Vma_id": 77201,
    "Vma_typ": 1,
    "Vma_typ_Namn": "MVC-mapp",
    "Pat_id": 551203,
    "Personnummer": "19930614-2384",
    "Vardgivare": "Region Stockholm",
    "Klinik": "MVC Södermalm",
    "Avd_id": 1204,
    "Avdelning": "MVC Södermalm barnmorskemottagning",
    "RegTid": "2025-04-08T09:18:00",
    "InskrDatum": "2025-04-08",
    "Barnmorska": 10421,
    "NatMhv3Finns": false,
    "SenastMens": "2025-02-10",
    "RegelbMens": 1,
    "RegelbMens_Text": "Regelbunden",
    "SpiralKvar": 9,
    "SpiralKvar_Text": "Ej angivet",
    "BerakForSM": "2025-11-17",
    "ULDatumOverfort": 0,
    "Vikt": 68,
    "Langd": 168,
    "TobakForegrav": 1,
    "SnusForeGrav": 1,
    "TobakInskr": 1,
    "SnusInskr": 1,
    "AlkoholForeGrav": 2,
    "AlkoholInskr": 1,
    "Tobak_vid_inskr": "Nej",
    "Tobak_3_man_fore_grav": "Nej",
    "Alkohol_vid_inskr": "Aldrig",
    "Alkohol_3_man_fore_grav": "Högst 1 gång per vecka",
    "Droger_vid_inskr": "Aldrig",
    "Droger_3_man_fore_grav": "Aldrig",
    "FamSitSammanb": true,
    "Sammanb_med_barnafadern": "Ja",
    "FamSitEnsams": false,
    "ForvarvsArb": 1,
    "Forv_Arb_vid_inskr": "Heltid",
    "BostadProb": 2,
    "Bost_eller_arb_Miljoproblem": "Nej",
    "OfrivBarnlosAr": "",
    "OfrivBarnlosIngen": 1,
    "OfrivBarnlosIVF": 0,
    "OfrivBarnlosOvulStim": 0,
    "OfrivBarnlosKirurgi": 0,
    "OfrivBarnlosICSI": 0,
    "OfrivBarnlosAnnat": 0,
    "Hereditet": "",
    "Hjart": "",
    "Trombos": "",
    "Psyk": "",
    "Gulsot": "",
    "Gynekolog": "",
    "Endokrina": "",
    "Urinvagsinf": "",
    "Lung": "",
    "Njur": "",
    "UlcerosColit": "",
    "Diabetes": "",
    "SLE": "",
    "Epilepsi": "",
    "Hypertoni": "",
    "SjukMhv3Finns": false,
    "IngenMedicinering": true,
    "TidBlodTrans": 2,
    "Tidigare_blodtransfusion": "Nej",
    "Bedomning": 1,
    "Bedomning_Test": "Basprogram",
    "Signering": 1,
    "FamSitAnnan": false,
    "RegisteredByProfessionalRoleId": 2,
    "FamSitPartner": false,
    "Bp_comp": "118/72",
    "Anteckning": "Förstföderska, opåverkad. Önskar basprogram. Information om KUB och rutin-UL given.",
    "GravPos": "2025-03-12",
    "LokReg": "Yrke: undersköterska. Arbetsplats: Södersjukhuset. BMI 24,1.",
    "BedomningSign": 10421,
    "M1TidigareGraviditeter": [],
    "M1Korr": [],
    "M1Medicinering": [],
    "BerakForUL": "",
    "Menstyp": "28",
    "Mensdagar": "5"
  }
]
