[
  {
    "Mhv1_id": 184887,
    "Vma_id": 77844,
    "Vma_typ": 1,
    "Vma_typ_Namn": "MVC-mapp",
    "Pat_id": 498112,
    "Personnummer": "19861103-4128",
    "Vardgivare": "Region Stockholm",
    "Klinik": "MVC Liljeholmen",
    "Avd_id": 1188,
    "Avdelning": "MVC Liljeholmen",
    "RegTid": "2025-03-19T13:42:00",
    "InskrDatum": "2025-03-19",
    "Barnmorska": 10887,
    "NatMhv3Finns": false,
    "SenastMens": "2025-01-05",
    "RegelbMens": 1,
    "RegelbMens_Text": "Regelbunden",
    "SpiralKvar": 9,
    "SpiralKvar_Text": "Ej angivet",
    "BerakForSM": "2025-10-12",
    "ULDatumOverfort": 1,
    "Vikt": 78,
    "Langd": 162,
    "TobakForegrav": 2,
    "SnusForeGrav": 1,
    "TobakInskr": 1,
    "SnusInskr": 1,
    "AlkoholForeGrav": 2,
    "AlkoholInskr": 1,
    "Tobak_vid_inskr": "Nej",
    "Tobak_3_man_fore_grav": "1-9 cig/dag",
    "Alkohol_vid_inskr": "Aldrig",
    "Alkohol_3_man_fore_grav": "Högst 1 gång per vecka",
    "Droger_vid_inskr": "Aldrig",
    "Droger_3_man_fore_grav": "Aldrig",
    "FamSitSammanb": true,
    "Sammanb_med_barnafadern": "Ja",
    "FamSitEnsams": false,
    "ForvarvsArb": 2,
    "Forv_Arb_vid_inskr": "Deltid",
    "BostadProb": 2,
    "Bost_eller_arb_Miljoproblem": "Nej",
    "OfrivBarnlosAr": "3",
    "OfrivBarnlosIngen": 0,
    "OfrivBarnlosIVF": 1,
    "OfrivBarnlosOvulStim": 0,
    "OfrivBarnlosKirurgi": 0,
    "OfrivBarnlosICSI": 0,
    "OfrivBarnlosAnnat": 0,
    "Hereditet": "Mamma diabetes typ 2. Mormor hypertoni.",
    "Hjart": "",
    "Trombos": "",
    "Psyk": "",
    "Gulsot": "",
    "Gynekolog": "",
    "Endokrina": "Hypotyreos, levotyroxin",
    "Urinvagsinf": "",
    "Lung": "Astma, vid behov salbutamol",
    "Njur": "",
    "UlcerosColit": "",
    "Diabetes": "",
    "SLE": "",
    "Epilepsi": "",
    "Hypertoni": "",
    "SjukMhv3Finns": true,
    "IngenMedicinering": false,
    "TidBlodTrans": 2,
    "Tidigare_blodtransfusion": "Nej",
    "Bedomning": 2,
    "Bedomning_Test": "MHV3",
    "Signering": 1,
    "FamSitAnnan": false,
    "RegisteredByProfessionalRoleId": 2,
    "FamSitPartner": false,
    "Bp_comp": "128/78",
    "Anteckning": "IVF-graviditet efter 3 års ofrivillig barnlöshet, ET 2025-01-12. Slutat röka vid positivt test. BMI 29,7. Remiss till obstetriker pga IVF, ålder och BMI. Fortsätter Levaxin 50 µg. Astma välkontrollerad.",
    "GravPos": "2025-01-26",
    "LokReg": "Yrke: förskollärare. Arbetsplats: Liljeholmens förskola. Rutin-UL 2025-03-12, CRL enligt v 10+1.",
    "BedomningSign": 10887,
    "M1TidigareGraviditeter": [
      {
        "Tabell": "M1TidigareGraviditeter",
        "TidGrav_id": 22011,
        "MHV1_id": 184887,
        "Ar": "2019",
        "Man": "05",
        "Typ": 2,
        "Typ_Text": "Spontan abort",
        "Sjukhus": "Södersjukhuset",
        "Forlopp": "Missfall v 8, expectans. Ingen kirurgi.",
        "Sectio": false,
        "Kon": 9,
        "Kon_barnet_text": "Ej angivet",
        "Vikt": 0,
        "Gravveckor": 8,
        "Tillstand": 9,
        "Tillstand_barnets_text": "Ej angivet",
        "Mhv3Ant_id": 0
      },
      {
        "Tabell": "M1TidigareGraviditeter",
        "TidGrav_id": 22012,
        "MHV1_id": 184887,
        "Ar": "2021",
        "Man": "09",
        "Typ": 5,
        "Typ_Text": "Levande fött",
        "Sjukhus": "Karolinska Huddinge",
        "Forlopp": "Spontan vaginal förlossning efter värkstimulering. Blödning 450 ml.",
        "Sectio": false,
        "Kon": 2,
        "Kon_barnet_text": "Flicka",
        "Vikt": 3480,
        "Gravveckor": 39,
        "Tillstand": 1,
        "Tillstand_barnets_text": "Mår idag u.a.",
        "Mhv3Ant_id": 0
      }
    ],
    "M1Korr": [],
    "M1Medicinering": [
      {
        "Tabell": "M1Medicinering",
        "Medicin_id": 9011,
        "MHV1_id": 184887,
        "Preperat": "Levaxin",
        "Dos": "50 µg 1x1",
        "FrGravVecka": 0,
        "TomGravVecka": 0
      },
      {
        "Tabell": "M1Medicinering",
        "Medicin_id": 9012,
        "MHV1_id": 184887,
        "Preperat": "T. Folacin",
        "Dos": "400 µg 1x1",
        "FrGravVecka": 0,
        "TomGravVecka": 12
      },
      {
        "Tabell": "M1Medicinering",
        "Medicin_id": 9013,
        "MHV1_id": 184887,
        "Preperat": "Ventoline",
        "Dos": "0,1 mg vid behov",
        "FrGravVecka": 0,
        "TomGravVecka": 0
      }
    ],
    "BerakForUL": "2025-10-14",
    "Menstyp": "30",
    "Mensdagar": "4"
  }
]
