[
  {
    "Mhv1_id": 185334,
    "Vma_id": 78102,
    "Vma_typ": 1,
    "Vma_typ_Namn": "MVC-mapp",
    "Pat_id": 612440,
    "Personnummer": "19950427-5820",
    "Vardgivare": "Region Uppsala",
    "Klinik": "MVC Gottsunda",
    "Avd_id": 3301,
    "Avdelning": "MVC Gottsunda",
    "RegTid": "2025-05-20T10:05:00",
    "InskrDatum": "2025-05-20",
    "Barnmorska": 11203,
    "NatMhv3Finns": false,
    "SenastMens": "2025-03-18",
    "RegelbMens": 2,
    "RegelbMens_Text": "Oregelbunden",
    "SpiralKvar": 1,
    "SpiralKvar_Text": "Uttagen",
    "BerakForSM": "2025-12-23",
    "ULDatumOverfort": 0,
    "Vikt": 91,
    "Langd": 170,
    "TobakForegrav": 3,
    "SnusForeGrav": 2,
    "TobakInskr": 2,
    "SnusInskr": 2,
    "AlkoholForeGrav": 3,
    "AlkoholInskr": 2,
    "Tobak_vid_inskr": "1-9 cig/dag",
    "Tobak_3_man_fore_grav": "10 el fler cig/dag",
    "Alkohol_vid_inskr": "Högst 1 gång per vecka",
    "Alkohol_3_man_fore_grav": "Mer än 1 gång per vecka",
    "Droger_vid_inskr": "Aldrig",
    "Droger_3_man_fore_grav": "Aldrig",
    "FamSitSammanb": false,
    "Sammanb_med_barnafadern": "Nej",
    "FamSitEnsams": true,
    "ForvarvsArb": 3,
    "Forv_Arb_vid_inskr": "Nej",
    "BostadProb": 1,
    "Bost_eller_arb_Miljoproblem": "Ja",
    "OfrivBarnlosAr": "",
    "OfrivBarnlosIngen": 1,
    "OfrivBarnlosIVF": 0,
    "OfrivBarnlosOvulStim": 0,
    "OfrivBarnlosKirurgi": 0,
    "OfrivBarnlosICSI": 0,
    "OfrivBarnlosAnnat": 0,
    "Hereditet": "Fader alkoholproblematik.",
    "Hjart": "",
    "Trombos": "",
    "Psyk": "Recidiverande depression, sertralin sedan 2023",
    "Gulsot": "",
    "Gynekolog": "Kopparspiral uttagen 2025-03-02",
    "Endokrina": "",
    "Urinvagsinf": "Upprepade UVI, senast jan 2025",
    "Lung": "",
    "Njur": "",
    "UlcerosColit": "",
    "Diabetes": "",
    "SLE": "",
    "Epilepsi": "",
    "Hypertoni": "",
    "SjukMhv3Finns": true,
    "IngenMedicinering": false,
    "TidBlodTrans": 1,
    "Tidigare_blodtransfusion": "Ja, 2020 efter sectio",
    "Bedomning": 2,
    "Bedomning_Test": "MHV3",
    "Signering": 1,
    "FamSitAnnan": false,
    "RegisteredByProfessionalRoleId": 2,
    "FamSitPartner": false,
    "Bp_comp": "136/84",
    "Anteckning": "Ensamstående omföderska, tillfälligt inneboende. Kopparspiral uttagen vid positivt test, oregelbunden mens — EDD enligt SM osäker, tidigt UL bokat. Röker 5 cig/dag + snus, motiverande samtal och hänvisning till rökavvänjning. AUDIT-uppföljning planeras. Kontakt med kurator och psykiatrisk öppenvård. Tidigare elektivt sectio — diskussion om förlossningssätt senare.",
    "GravPos": "2025-04-28",
    "LokReg": "Tolk ej aktuellt. Närmast anhörig: syster, Uppsala. BMI 31,5. Bostadsproblematik journalförd.",
    "BedomningSign": 11203,
    "M1TidigareGraviditeter": [
      {
        "Tabell": "M1TidigareGraviditeter",
        "TidGrav_id": 33101,
        "MHV1_id": 185334,
        "Ar": "2018",
        "Man": "11",
        "Typ": 3,
        "Typ_Text": "Legal abort",
        "Sjukhus": "Akademiska sjukhuset",
        "Forlopp": "Medicinsk abort v 7.",
        "Sectio": false,
        "Kon": 9,
        "Kon_barnet_text": "Ej angivet",
        "Vikt": 0,
        "Gravveckor": 7,
        "Tillstand": 9,
        "Tillstand_barnets_text": "Ej angivet",
        "Mhv3Ant_id": 0
      },
      {
        "Tabell": "M1TidigareGraviditeter",
        "TidGrav_id": 33102,
        "MHV1_id": 185334,
        "Ar": "2020",
        "Man": "06",
        "Typ": 5,
        "Typ_Text": "Levande fött",
        "Sjukhus": "Akademiska sjukhuset",
        "Forlopp": "Elektivt sectio pga sätesbjudning. Postpartumblödning, transfusion 2 E erytrocyter.",
        "Sectio": true,
        "Kon": 1,
        "Kon_barnet_text": "Pojke",
        "Vikt": 4120,
        "Gravveckor": 41,
        "Tillstand": 1,
        "Tillstand_barnets_text": "Mår idag u.a.",
        "Mhv3Ant_id": 0
      }
    ],
    "M1Korr": [
      {
        "Tabell": "M1Korr",
        "Korr_id": 4401,
        "Mhv1_id": 185334,
        "User_id": 11203,
        "CollectionMember": 1,
        "Term": 12,
        "AndringsDatum": "2025-05-20T14:22:00"
      }
    ],
    "M1Medicinering": [
      {
        "Tabell": "M1Medicinering",
        "Medicin_id": 9101,
        "MHV1_id": 185334,
        "Preperat": "Sertralin",
        "Dos": "50 mg 1x1",
        "FrGravVecka": 0,
        "TomGravVecka": 0
      },
      {
        "Tabell": "M1Medicinering",
        "Medicin_id": 9102,
        "MHV1_id": 185334,
        "Preperat": "T. Folacin",
        "Dos": "400 µg 1x1",
        "FrGravVecka": 0,
        "TomGravVecka": 12
      }
    ],
    "BerakForUL": "",
    "Menstyp": "Oregelbunden",
    "Mensdagar": "3-8"
  }
]
